course_title,description
Machine Learning with Python,"Dive into Machine Learning with Python, covering supervised and unsupervised learning, regression, classification, and clustering. Gain hands-on experience using SciPy and scikit-learn libraries."
Applied Machine Learning in Python,"Learn applied machine learning techniques using Python, from clustering to predictive modeling, with a focus on practical implementation and evaluation using scikit-learn."
Mathematics for Machine Learning: Linear Algebra,"Explore linear algebra fundamentals and their applications in machine learning, covering vectors, matrices, eigenvalues, and practical implementations in Python for data-driven tasks."
Mathematics for Machine Learning: Multivariate Calculus,"Explore multivariate calculus essentials for machine learning, covering gradients, chain rule, Taylor series, and optimization techniques, with practical applications in neural networks and regression."
Machine Learning with Python: from Linear Models to Deep Learning.,"An in-depth introduction to the field of machine learning, from linear models to deep learning and reinforcement learning, through hands-on Python projects. -- Part of the MITx MicroMasters program in Statistics and Data Science."
